postid|data
14872829|"from nose.tools import assert_raises&#xa;from sqlalchemy.exc import IntegrityError&#xa;from flask.ext.testing import TestCase&#xa;&#xa;from flask_truss.factory import create_app&#xa;from flask_truss.conf.app import Config&#xa;from flask_truss.models.base import db&#xa;&#xa;&#xa;class LocalhostProxyHack(object):&#xa;    """"""Ensures that a remote_addr is available for testing.&#xa;    From http://stackoverflow.com/questions/14872829/get-ip-address-when-testing-flask-application-through-nosetests&#xa;    """"""&#xa;    def __init__(self, app):&#xa;        self.app = app&#xa;&#xa;    def __call__(self, environ, start_response):&#xa;        environ['REMOTE_ADDR'] = environ.get('REMOTE_ADDR', '127.0.0.1')&#xa;        return self.app(environ, start_response)&#xa;&#xa;&#xa;class BaseTestCase(TestCase):&#xa;    def create_app(self):&#xa;        config = Config()&#xa;        app = create_app(config)&#xa;        app.config['TESTING'] = True&#xa;        app.config['WTF_CSRF_ENABLED'] = False&#xa;        app.wsgi_app = LocalhostProxyHack(app.wsgi_app)&#xa;        test_client = app.test_client()&#xa;        app.post = test_client.post&#xa;        app.get = test_client.get&#xa;        return app&#xa;&#xa;    def setUp(self):&#xa;        """"""Create the testing database, then swap commit for flush""""""&#xa;        db.create_all()&#xa;        self.orig_commit = db.session.commit&#xa;        db.session.commit = db.session.flush&#xa;&#xa;    def tearDown(self):&#xa;        """"""Clean up session, sway flush for commit, drop the testing database""""""&#xa;        db.session.remove()&#xa;        db.session.commit = self.orig_commit&#xa;        db.drop_all()&#xa;&#xa;    def add_to_session_and_flush_expecting_exception(self, obj):&#xa;        db.session.add(obj)&#xa;        assert_raises(IntegrityError, db.session.flush)&#xa;        db.session.rollback()&#xa;&#xa;    def add_to_session_and_flush(self, obj):&#xa;        db.session.add(obj)&#xa;        db.session.flush()&#xa;"
651794|"'''&#xa;Created on Sep 15, 2012&#xa;&#xa;@author: gaprice@lbl.gov&#xa;'''&#xa;&#xa;from collections import defaultdict as _defaultdict&#xa;&#xa;&#xa;class AutoVivifingDict(dict):&#xa;    """"""Implementation of perl's autovivification feature.""""""&#xa;# see http://stackoverflow.com/questions/651794/whats-the-best-way-to-&#xa;# initialize-a-dict-of-dicts-in-python&#xa;&#xa;    def __getitem__(self, item):&#xa;        try:&#xa;            return dict.__getitem__(self, item)&#xa;        except KeyError:&#xa;            value = self[item] = type(self)()&#xa;            return value&#xa;&#xa;&#xa;class DictListWithSortedIterator(object):&#xa;    ''' Implements a dict-like object, the values of which are lists of&#xa;  objects. The iterator returned from the __iter__ method traverses the lists&#xa;  in order of 1) the sorted list of keys and 2) the order the items were added&#xa;  to the list. Once iteration is started, the DLWSI cannot be modified until&#xa;  the iterator is exhausted or the discard() method is called on the&#xa;  iterator.'''&#xa;&#xa;    def __init__(self):&#xa;        self._store = _defaultdict(list)&#xa;        self._itercount = 0&#xa;        self._len = 0&#xa;&#xa;    def __setitem__(self, key, value):&#xa;        '''Add value to the end of the list stored at key'''&#xa;        self._check_iter_ok()&#xa;        self._store[key].append(value)&#xa;        self._len += 1&#xa;&#xa;    def __delitem__(self, key):&#xa;        '''Delete the list stored at key.'''&#xa;        self._check_iter_ok()&#xa;        if key in self._store:&#xa;            l = len(self._store[key])&#xa;            del self._store[key]&#xa;            self._len -= l&#xa;&#xa;    def __getitem__(self, key):&#xa;        '''Returns the list stored at key as a tuple.'''&#xa;        if self._store[key]:&#xa;            return tuple(self._store[key])&#xa;        else:&#xa;            raise KeyError(str(key))&#xa;&#xa;    def get(self, key, default=None):&#xa;        '''Returns the list stored at key as a tuple. The default argument&#xa;    specifies the object to return if key does not exist (default None).'''&#xa;        if self._store[key]:&#xa;            return tuple(self._store[key])&#xa;        return default&#xa;&#xa;    def keys(self):&#xa;        '''Returns an unsorted list of keys.'''&#xa;        return self._store.keys()&#xa;&#xa;    def __len__(self):&#xa;        return self._len&#xa;&#xa;    def clear(self):&#xa;        '''Removes all keys and values from the DLWSI.'''&#xa;        self._check_iter_ok()&#xa;        self._store = _defaultdict(list)&#xa;        self._len = 0&#xa;&#xa;    def merge(self, dictlist):&#xa;        '''Adds all key value pairs of the passed in DLWSI to this DLWSI. Any&#xa;    keys in this DLWSI that have matching names to keys in the passed in DLWSI&#xa;    will be overwritten.'''&#xa;        self._check_iter_ok()&#xa;        for k, v in dictlist:&#xa;            self.__setitem__(k, v)&#xa;&#xa;    def _check_iter_ok(self):&#xa;        if self._itercount:&#xa;            raise RuntimeError('Attempt to modify while iterating')&#xa;&#xa;    def __iter__(self):&#xa;        '''Returns an iterator over this DLWSI. The iterator proceeds through&#xa;    each list in the order of the sorted keys and returns a key / list item&#xa;    pair for each next call. Thus if a particular key has 3 list items that&#xa;    key will be returned 3 times in succession, once with each list item.&#xa;    The DLWSI cannot be modified while iterating. To allow modification without&#xa;    exhausting the iterator call the discard() method on the iterator.'''&#xa;        if not self._itercount:&#xa;            self._sortedKeys = sorted(self._store.keys())&#xa;        self._itercount += 1&#xa;        return self._ObjIter(self)&#xa;&#xa;    class _ObjIter(object):&#xa;&#xa;        def __init__(self, objStore):&#xa;            self._ostore = objStore&#xa;            self._dictindex = 0&#xa;            self._listindex = -1&#xa;            self._notexhausted = True&#xa;&#xa;        def next(self):&#xa;            if self._notexhausted and self._has_next():&#xa;                self._advance_index()&#xa;                return self._get_current_key_val_tuple()&#xa;            else:&#xa;                self._dec_iter_count()&#xa;                raise StopIteration&#xa;&#xa;        def discard(self):&#xa;            self._dec_iter_count()&#xa;&#xa;        def _dec_iter_count(self):&#xa;            if self._notexhausted:&#xa;                self._ostore._itercount -= 1&#xa;            self._notexhausted = False&#xa;&#xa;        def _has_next(self):&#xa;            if len(self._ostore._store) == 0:&#xa;                return False&#xa;            dictI = self._dictindex&#xa;            if self._listindex + 1 >= len(self._get_list(&#xa;                                          self._get_sorted_key(dictI))):&#xa;                dictI += 1&#xa;            return dictI < len(self._ostore._sortedKeys)&#xa;&#xa;        def _advance_index(self):&#xa;            if self._listindex + 1 >= len(self._get_list(self._get_sorted_key(&#xa;                                                         self._dictindex))):&#xa;                self._dictindex += 1&#xa;                self._listindex = 0&#xa;            else:&#xa;                self._listindex += 1&#xa;&#xa;        def _get_current_key_val_tuple(self):&#xa;            key = self._get_sorted_key(self._dictindex)&#xa;            return key, self._get_list(key)[self._listindex]&#xa;&#xa;        def _get_sorted_key(self, index):&#xa;            return self._ostore._sortedKeys[index]&#xa;&#xa;        def _get_list(self, key):&#xa;            return self._ostore._store[key]&#xa;&#xa;        def __next__(self):&#xa;            return self.next()&#xa;"
